[
  {
    "id": "of_haldi_mustard_sharara",
    "title": "Mustard mulmul sharara, haldi-proof",
    "occasions": ["haldi"],
    "ethnic_dial": "desi",
    "vibes": ["soft_cute", "comfy"],
    "company_fit": ["family", "mixed"],
    "weather_fit": ["hot_humid", "dry_heat", "pleasant"],
    "palette": ["mustard", "white", "gold"],
    "modesty_level": 2,
    "comfort": ["flats_only", "easy_to_dance", "no_dupatta"],
    "price_band_inr": [1500, 3500],
    "trend_tags": ["sharara_coord"],
    "items": [
      { "slot": "top", "garment": "short_kurti", "colour": "mustard", "fabric": "mulmul", "print": "gota_patti", "length": "hip" },
      { "slot": "bottom", "garment": "sharara", "colour": "mustard", "fabric": "mulmul", "length": "ankle" },
      { "slot": "footwear", "garment": "kolhapuris", "colour": "gold" },
      { "slot": "jewellery", "garment": "jhumkas", "colour": "gold" }
    ],
    "styling_tip": "Skip the dupatta. Turmeric stains won't show on mustard, and you can actually dance.",
    "tote_pairing": { "sku": "TBD", "reason": "Ivory canvas tote to hold the haldi bowls, and it won't clash with yellow" },
    "accessory_pairing": ["floral hair clip"],
    "source": { "type": "curated" },
    "review": { "tagged_by": "human", "approved": false }
  },
  {
    "id": "of_mehendi_mint_lehenga_shirt",
    "title": "Mint lehenga skirt + white shirt",
    "occasions": ["mehendi", "roka_engagement"],
    "ethnic_dial": "indo_western",
    "vibes": ["main_character", "romantic"],
    "company_fit": ["friends", "mixed", "family"],
    "weather_fit": ["pleasant", "ac_indoors", "dry_heat"],
    "palette": ["mint", "white", "silver"],
    "modesty_level": 2,
    "comfort": ["no_dupatta", "covered_shoulders", "below_knee"],
    "price_band_inr": [2500, 6000],
    "trend_tags": ["lehenga_skirt_with_shirt"],
    "items": [
      { "slot": "top", "garment": "shirt", "colour": "white", "fabric": "cotton" },
      { "slot": "bottom", "garment": "lehenga_skirt", "colour": "mint", "fabric": "georgette", "print": "floral", "length": "floor" },
      { "slot": "footwear", "garment": "juttis", "colour": "silver" },
      { "slot": "jewellery", "garment": "oxidised_silver", "colour": "silver" }
    ],
    "styling_tip": "Knot the shirt at the waist and roll the sleeves, so your mehendi hands are the hero.",
    "tote_pairing": { "sku": "TBD", "reason": "Pastel floral tote goes with the mehendi-garden vibe" },
    "accessory_pairing": ["silver jhumkas"],
    "source": { "type": "curated" },
    "review": { "tagged_by": "human", "approved": false }
  },
  {
    "id": "of_sangeet_wine_sequin",
    "title": "Wine sequin lehenga for sangeet",
    "occasions": ["sangeet", "cocktail", "reception"],
    "ethnic_dial": "desi",
    "vibes": ["main_character", "bold"],
    "company_fit": ["friends", "mixed"],
    "weather_fit": ["pleasant", "cold", "ac_indoors"],
    "palette": ["wine", "gold"],
    "modesty_level": 1,
    "comfort": ["easy_to_dance"],
    "price_band_inr": [6000, 15000],
    "trend_tags": [],
    "items": [
      { "slot": "full", "garment": "lehenga_set", "colour": "wine", "fabric": "georgette", "print": "sequins", "length": "floor" },
      { "slot": "footwear", "garment": "block_heels", "colour": "gold" },
      { "slot": "jewellery", "garment": "chandbalis", "colour": "gold" },
      { "slot": "bag", "garment": "potli", "colour": "gold" }
    ],
    "styling_tip": "Sequins catch the stage lights. Keep the jewellery to just statement earrings.",
    "tote_pairing": { "sku": "TBD", "reason": "Bring a tote for your sneaker switch after the performance" },
    "accessory_pairing": ["gold potli"],
    "source": { "type": "curated" },
    "review": { "tagged_by": "human", "approved": false }
  },
  {
    "id": "of_college_oversized_tee",
    "title": "Oversized graphic tee + wide-leg denims",
    "occasions": ["college", "errands", "movie_outing", "travel_airport"],
    "ethnic_dial": "western",
    "vibes": ["comfy", "streetwear"],
    "company_fit": ["friends", "mixed"],
    "weather_fit": ["pleasant", "ac_indoors", "dry_heat"],
    "palette": ["white", "sky_blue", "black"],
    "modesty_level": 2,
    "comfort": ["flats_only", "pockets", "covered_shoulders"],
    "price_band_inr": [800, 2500],
    "trend_tags": ["oversized_tee_wide_leg"],
    "items": [
      { "slot": "top", "garment": "graphic_tee", "colour": "white", "fabric": "cotton" },
      { "slot": "bottom", "garment": "wide_leg_jeans", "colour": "sky_blue", "fabric": "denim", "length": "ankle" },
      { "slot": "footwear", "garment": "sneakers", "colour": "white" },
      { "slot": "jewellery", "garment": "hoops", "colour": "silver" }
    ],
    "styling_tip": "Front-tuck the tee so it doesn't swallow you.",
    "tote_pairing": { "sku": "TBD", "reason": "Quirky printed tote that fits a laptop, and it's the loudest thing you're wearing" },
    "accessory_pairing": ["claw clip"],
    "source": { "type": "curated" },
    "review": { "tagged_by": "human", "approved": false }
  },
  {
    "id": "of_office_chikankari_trousers",
    "title": "Chikankari shirt + tailored trousers",
    "occasions": ["office", "brunch", "interview", "first_day_work"],
    "ethnic_dial": "indo_western",
    "vibes": ["minimal", "boss", "old_money"],
    "company_fit": ["colleagues", "family", "mixed"],
    "weather_fit": ["hot_humid", "dry_heat", "pleasant", "ac_indoors"],
    "palette": ["ivory", "beige"],
    "modesty_level": 3,
    "comfort": ["no_dupatta", "flats_only", "covered_shoulders", "below_knee", "pockets", "no_sheer"],
    "price_band_inr": [1800, 4500],
    "trend_tags": ["old_money_ethnic"],
    "items": [
      { "slot": "top", "garment": "shirt", "colour": "ivory", "fabric": "chikankari", "print": "chikankari_embroidery" },
      { "slot": "bottom", "garment": "trousers", "colour": "beige", "fabric": "linen", "length": "ankle" },
      { "slot": "footwear", "garment": "loafers", "colour": "brown" },
      { "slot": "jewellery", "garment": "studs", "colour": "gold" }
    ],
    "styling_tip": "Wear a camisole under the chikankari, and add a thin gold chain for the old-money look.",
    "tote_pairing": { "sku": "TBD", "reason": "Structured neutral tote that holds a laptop and goes with a boardroom" },
    "accessory_pairing": ["thin gold chain", "watch"],
    "source": { "type": "curated" },
    "review": { "tagged_by": "human", "approved": false }
  },
  {
    "id": "of_farewell_black_saree",
    "title": "Pre-draped black saree + corset blouse",
    "occasions": ["farewell", "cocktail", "college_fest"],
    "ethnic_dial": "indo_western",
    "vibes": ["main_character", "bold"],
    "company_fit": ["friends", "mixed"],
    "weather_fit": ["pleasant", "ac_indoors", "cold"],
    "palette": ["black", "silver"],
    "modesty_level": 1,
    "comfort": ["easy_to_dance", "no_dupatta"],
    "price_band_inr": [2500, 7000],
    "trend_tags": ["corset_blouse_saree", "pre_draped_saree"],
    "items": [
      { "slot": "full", "garment": "pre_draped_saree", "colour": "black", "fabric": "georgette", "print": "sequins", "length": "floor" },
      { "slot": "top", "garment": "corset_blouse", "colour": "black", "fabric": "satin" },
      { "slot": "footwear", "garment": "block_heels", "colour": "silver" },
      { "slot": "jewellery", "garment": "chandbalis", "colour": "silver" }
    ],
    "styling_tip": "Pre-draped means no safety-pin panic. Swap to sneakers for the dance floor.",
    "tote_pairing": { "sku": "TBD", "reason": "Black-and-white illustrated tote for the sneaker and makeup kit" },
    "accessory_pairing": ["silver bangles"],
    "source": { "type": "curated" },
    "review": { "tagged_by": "human", "approved": false }
  },
  {
    "id": "of_garba_mirror_chaniya",
    "title": "Mirror-work chaniya choli for garba",
    "occasions": ["navratri_garba"],
    "ethnic_dial": "desi",
    "vibes": ["bold", "main_character"],
    "company_fit": ["friends", "family", "mixed"],
    "weather_fit": ["hot_humid", "pleasant", "dry_heat"],
    "palette": ["red", "orange", "emerald"],
    "modesty_level": 1,
    "comfort": ["easy_to_dance", "flats_only"],
    "price_band_inr": [1500, 5000],
    "trend_tags": [],
    "items": [
      { "slot": "full", "garment": "lehenga_set", "colour": "red", "fabric": "cotton", "print": "mirror_work", "length": "ankle" },
      { "slot": "layer", "garment": "dupatta", "colour": "emerald", "print": "bandhani" },
      { "slot": "footwear", "garment": "mojari", "colour": "gold" },
      { "slot": "jewellery", "garment": "oxidised_silver", "colour": "silver" }
    ],
    "styling_tip": "Ankle-length so you don't trip on the spins. Pin the dupatta at the shoulder AND the waist.",
    "tote_pairing": { "sku": "TBD", "reason": "Bright tote for a water bottle and spare bindis" },
    "accessory_pairing": ["oxidised kamarbandh", "anklet"],
    "source": { "type": "curated" },
    "review": { "tagged_by": "human", "approved": false }
  },
  {
    "id": "of_brunch_linen_coord",
    "title": "Sage linen co-ord set",
    "occasions": ["brunch", "date_night", "travel_airport", "wfh_call"],
    "ethnic_dial": "western",
    "vibes": ["minimal", "soft_cute", "old_money"],
    "company_fit": ["friends", "date", "family", "colleagues"],
    "weather_fit": ["hot_humid", "dry_heat", "pleasant"],
    "palette": ["sage", "white"],
    "modesty_level": 2,
    "comfort": ["flats_only", "no_dupatta", "pockets"],
    "price_band_inr": [1500, 3500],
    "trend_tags": ["coord_set"],
    "items": [
      { "slot": "full", "garment": "coord_set", "colour": "sage", "fabric": "linen", "length": "ankle" },
      { "slot": "footwear", "garment": "sandals", "colour": "beige" },
      { "slot": "jewellery", "garment": "layered_chains", "colour": "gold" }
    ],
    "styling_tip": "Leave the shirt half open over a white tank and you're ready for Goa.",
    "tote_pairing": { "sku": "TBD", "reason": "Natural canvas tote. It's the whole beach-brunch look" },